501,Interprofessional Practice in Mental Health,IPHE 501,One of Community Rehabilitation 209$ 435$ Kinesiology 355$ Nursing 303$ 305$ Psychology 203$ 205$ Social Work 300$ 302$ 304$ 306$ 363 or consent of the instructor(s).,none,none
503,Interprofessional Practice in Addictions,IPHE 503,One of Community Rehabilitation 209$ 435$ Kinesiology 355$ Nursing 303$ 305$ Psychology 203$ 205$ Social Work 300$ 302$ 304$ 306$ 363 or consent of the instructor(s).,none,none
598,Selected Topics in Interprofessional Health Education,IPHE 598,Consent of the Faculty.,none,none
601,Interprofessional Practice in Mental Health,IPHE 601,Consent of the instructor(s).,none,none
603,Interprofessional Practice in Addictions ,IPHE 603,Consent of the instructor(s).,none,none
605,Interprofessional Approaches to Assessment$ Diagnosis and Treatment in Mental Health and Addictions: The Major Disorders - Part A,IPHE 605,Consent of the instructor(s).,none,none
607,Interprofessional Approaches to Assessment$ Diagnosis and Treatment in Mental Health and Addictions: Personality Disorders and Special Populations - Part B,IPHE 607,Consent of the instructor(s).,none,none
609,Psychiatric$ Psychosocial and Recovery Approaches in Mental Health and Addictions,IPHE 609,Consent of the instructor(s).,none,none
611,Special Topics in Interprofessional Mental Health Addictions,IPHE 611,Consent of the instructor(s).,none,none