317,Introduction to Risk Management and Insurance,RMIN 317,Admission to the Haskayne School of Business or the Actuarial Science program$ and 30 units including Economics 201. ,none,none
439,Protecting your Family and Wealth,RMIN 439,Admission to the Haskayne School of Business or the Actuarial Science program$ and Finance 317 or Risk Management and Insurance 317. ,none,none
449,Employee Benefits and Social Insurance,RMIN 449,Admission to the Haskayne School of Business or the Actuarial Science program$ and Finance 317 or Risk Management and Insurance 317. ,none,none
459,Managing Commercial Property and Liability Risks,RMIN 459,Admission to the Haskayne School of Business.,none,or Prerequisite(s): Risk Management and Insurance 317.
559,Selected Topics in Risk Management and Insurance,RMIN 559,Admission to the Haskayne School of Business and Risk Management and Insurance 317. For certain topics$ consent of the Haskayne School of Business will also be required.,none,none
579,Advanced Topics in Risk Management and Insurance,RMIN 579,Admission to the Haskayne School of Business and Risk Management and Insurance 317.,none,none
763,Managing Risks and Disasters,RMIN 763,Consent of the Haskayne School of Business.,none,none